{"entries":[{"kind":"dir","offset":0,"path":"data","size":0},{"kind":"file","offset":4453984,"path":"data/after.txt","size":137},{"kind":"file","offset":4453832,"path":"data/mid.txt","size":82},{"kind":"dir","offset":0,"path":"data/nested","size":0},{"kind":"file","offset":4453916,"path":"data/nested/deep.txt","size":67},{"kind":"file","offset":4453696,"path":"top.txt","size":133}],"format":"gc-fst","source":{"name":"game.iso","sha256":"cdeec2d9ab0930f61de1a2c2af592c3c45f4502567969d00214bfa43e649b2ed","size":1459978240},"tool_versions":{"generator":"make_gc_fst_nested_fixture v1","wit":"Wiimms ISO Tool v3.05a r8638 cygwin64 - Dirk Clemens - 2022-08-27"}}
