{"entries":[{"kind":"dir","offset":49152,"path":"BOOT","size":2048},{"kind":"file","offset":59392,"path":"BOOT/APP.ELF","size":100000},{"kind":"dir","offset":51200,"path":"DATA","size":2048},{"kind":"file","offset":159744,"path":"DATA/A.BIN","size":256},{"kind":"file","offset":161792,"path":"DATA/B.BIN","size":2048},{"kind":"file","offset":0,"path":"DATA/EMPTY.BIN","size":0},{"kind":"dir","offset":53248,"path":"DATA/SUB","size":2048},{"kind":"file","offset":163840,"path":"DATA/SUB/C.DAT","size":5000},{"kind":"file","offset":55296,"path":"README.TXT","size":137},{"kind":"file","offset":57344,"path":"SYSTEM.CNF","size":57}],"format":"ps1-bincue","source":{"name":"game.bin","sha256":"1bbbe494faca80f5b5ef1df84a4bf83a5dbf5938ef53bb01336ecd241f6b9623","size":169984},"tool_versions":{"7z":"7-Zip 26.02 (x64) 2026-06-25","chdman":"0.288 (mame0288)","generator":"make_ps1_bincue_fixture v1","pycdlib":"1.16.0"}}
