{"entries":[{"kind":"file","offset":4068421448,"path":"KDW.brsar","size":7664128},{"kind":"file","offset":2601451520,"path":"d01.dat","size":31436800},{"kind":"file","offset":2632908800,"path":"d02.dat","size":5433344},{"kind":"file","offset":2638348288,"path":"d03.dat","size":226914304},{"kind":"file","offset":2865266688,"path":"d04.dat","size":93028352},{"kind":"dir","offset":0,"path":"data","size":0},{"kind":"dir","offset":0,"path":"data/movie","size":0},{"kind":"file","offset":2958303336,"path":"data/movie/CO_EPISODE_NTSC_N.thp","size":132377664},{"kind":"file","offset":3090681000,"path":"data/movie/CO_EPISODE_NTSC_W.thp","size":172154464},{"kind":"file","offset":3262835464,"path":"data/movie/ENDING_NTSC_N.thp","size":78243712},{"kind":"file","offset":3341079176,"path":"data/movie/ENDING_NTSC_W.thp","size":102417440},{"kind":"file","offset":3443496616,"path":"data/movie/OPENING_NTSC_N.thp","size":81857728},{"kind":"file","offset":3525354344,"path":"data/movie/OPENING_NTSC_W.thp","size":107167520},{"kind":"file","offset":3632521864,"path":"data/movie/PROLOGUE_NTSC_N.thp","size":214967200},{"kind":"file","offset":3847489064,"path":"data/movie/PROLOGUE_NTSC_W.thp","size":220932384},{"kind":"file","offset":4076085576,"path":"opening.bnr","size":401464},{"kind":"dir","offset":0,"path":"stream","size":0},{"kind":"file","offset":4076487040,"path":"stream/BGM_EVENT_BOSS.brstm","size":1223616},{"kind":"file","offset":4077710656,"path":"stream/BGM_EVENT_FUKITSU.brstm","size":2132224},{"kind":"file","offset":4079842880,"path":"stream/BGM_EVENT_HAPPY.brstm","size":2705312},{"kind":"file","offset":4082548192,"path":"stream/BGM_EVENT_NORMAL.brstm","size":2035232},{"kind":"file","offset":4084583424,"path":"stream/BGM_HOME.brstm","size":10377856},{"kind":"file","offset":4094961280,"path":"stream/BGM_RESULT.brstm","size":1248672},{"kind":"file","offset":4096209952,"path":"stream/BGM_STUFF.brstm","size":10160352},{"kind":"file","offset":4106370304,"path":"stream/BGM_ST_BOSS.brstm","size":9961216},{"kind":"file","offset":4116331520,"path":"stream/BGM_ST_BOSS_ESCAPE.brstm","size":1931936},{"kind":"file","offset":4118263456,"path":"stream/BGM_ST_BOSS_LAST.brstm","size":7543392},{"kind":"file","offset":4125806848,"path":"stream/BGM_ST_GOAST.brstm","size":5939456},{"kind":"file","offset":4131746304,"path":"stream/BGM_ST_GOAST_RMX.brstm","size":6793824},{"kind":"file","offset":4138540128,"path":"stream/BGM_ST_GOHST.brstm","size":5939456},{"kind":"file","offset":4144479584,"path":"stream/BGM_ST_ISLAND.brstm","size":9186752},{"kind":"file","offset":4153666336,"path":"stream/BGM_ST_ISLAND_RMX.brstm","size":10055200},{"kind":"file","offset":4163721536,"path":"stream/BGM_ST_JUNGLE.brstm","size":10050272},{"kind":"file","offset":4173771808,"path":"stream/BGM_ST_JUNGLE_RMX.brstm","size":11538752},{"kind":"file","offset":4185310560,"path":"stream/BGM_ST_MOUNTAIN.brstm","size":6367072},{"kind":"file","offset":4191677632,"path":"stream/BGM_ST_MOUNTAIN_RMX.brstm","size":8466592},{"kind":"file","offset":4200144224,"path":"stream/BGM_ST_PLANT.brstm","size":10366016},{"kind":"file","offset":4210510240,"path":"stream/BGM_ST_PLANT_RMX.brstm","size":9327168},{"kind":"file","offset":4219837408,"path":"stream/BGM_ST_SEA.brstm","size":10823200},{"kind":"file","offset":4230660608,"path":"stream/BGM_ST_SEA_RMX.brstm","size":9978752},{"kind":"file","offset":4240639360,"path":"stream/BGM_ST_SKY.brstm","size":5923072},{"kind":"file","offset":4246562432,"path":"stream/BGM_ST_SKY_RMX.brstm","size":8404928},{"kind":"file","offset":4254967360,"path":"stream/BGM_ST_SPACE.brstm","size":10760768},{"kind":"file","offset":4265728128,"path":"stream/BGM_ST_SPACE_RMX.brstm","size":6503648},{"kind":"file","offset":4272231776,"path":"stream/BGM_TITLE.brstm","size":864800},{"kind":"file","offset":4273096576,"path":"stream/BGM_TUTORIAL.brstm","size":2721696},{"kind":"file","offset":4275818272,"path":"stream/BGM_WORLD_SELECT.brstm","size":3088224},{"kind":"file","offset":4278982240,"path":"stream/JNG_CLEAR.brstm","size":106848},{"kind":"file","offset":4279089088,"path":"stream/JNG_FINAL.brstm","size":227744},{"kind":"file","offset":4279316832,"path":"stream/JNG_GAMEOVER.brstm","size":182176},{"kind":"file","offset":4285767648,"path":"stream/SE_ALL_POWERUP.brstm","size":548864},{"kind":"file","offset":4278906496,"path":"stream/jin_clear.brstm","size":75744},{"kind":"file","offset":4279499008,"path":"stream/sampleBGM.brstm","size":6268640}],"format":"wii-fst","source":{"name":"The Munchables (USA).iso","sha256":"64c012f35d0c8b97e34c13e47060550b36d89fc36bed2691661cfdf108671cbb","size":4286328832},"tool_versions":{"generator":"stage_wii_fst_retail_anchor v1","wit":"Wiimms ISO Tool v3.05a r8638 cygwin64 - Dirk Clemens - 2022-08-27"}}
