{"entries":[{"kind":"file","offset":0,"path":"Adventure Time - Hey Ice King! Why'd You Steal Our Garbage!! (USA) (Beta) (2012-05-11).3ds","size":39018496}],"format":"zip","source":{"name":"Adventure Time - Hey Ice King! Why'd You Steal Our Garbage!! (USA) (Beta) (2012-05-11).zip","sha256":"bafaaf823a47a2962363a70e2c1f578ef45d37145d5cadba075239135e913b17","size":39018496},"tool_versions":{"differential":"7-Zip 26.02 (x64) 2026-06-25","generator":"retail Adventure Time Hey Ice King (Beta) 2012-05-11 via 7z l -slt","self-consistency":"structural-proof"}}
