{"entries":[{"kind":"dir","offset":49152,"path":"BOOT","size":2048},{"kind":"file","offset":59392,"path":"BOOT/APP.ELF","size":100000},{"kind":"dir","offset":51200,"path":"DATA","size":2048},{"kind":"file","offset":159744,"path":"DATA/A.BIN","size":256},{"kind":"file","offset":161792,"path":"DATA/B.BIN","size":2048},{"kind":"file","offset":0,"path":"DATA/EMPTY.BIN","size":0},{"kind":"dir","offset":53248,"path":"DATA/SUB","size":2048},{"kind":"file","offset":163840,"path":"DATA/SUB/C.DAT","size":5000},{"kind":"file","offset":55296,"path":"README.TXT","size":131},{"kind":"file","offset":57344,"path":"SYSTEM.CNF","size":57}],"format":"iso9660","source":{"name":"synthetic.iso","sha256":"9c554204a0091320b7469ff658a166cbca6e8e1bc1168e4115394ccee8f0792b","size":169984},"tool_versions":{"7z":"7-Zip 26.02 (x64) 2026-06-25","generator":"make_iso_fixture v1","pycdlib":"1.16.0"}}
