{"entries":[{"kind":"file","offset":0,"path":"BIG/Z64.BIN","size":1024},{"kind":"file","offset":1024,"path":"BOOT/APP.BIN","size":4096},{"kind":"dir","offset":0,"path":"DATA","size":0},{"kind":"file","offset":5120,"path":"DATA/A.BIN","size":256},{"kind":"file","offset":5376,"path":"DATA/B.BIN","size":2048},{"kind":"file","offset":7424,"path":"DATA/EMPTY.BIN","size":0},{"kind":"dir","offset":0,"path":"DATA/SUB","size":0},{"kind":"file","offset":7424,"path":"DATA/SUB/C.DAT","size":512},{"kind":"file","offset":7936,"path":"README.TXT","size":77}],"format":"zip","source":{"name":"game.zip","sha256":"5253b07995b7ed9971b3c11156898e6626b1be532ab1235b504da5c37b137160","size":8013},"tool_versions":{"differential":"7-Zip 26.02 (x64) 2026-06-25","generator":"make_zip_fixture v1","self-consistency":"structural-proof"}}
