{"entries":[{"kind":"dir","offset":49152,"path":"BOOT","size":2048},{"kind":"file","offset":59392,"path":"BOOT/APP.BIN","size":100000},{"kind":"dir","offset":51200,"path":"DATA","size":2048},{"kind":"file","offset":159744,"path":"DATA/A.BIN","size":256},{"kind":"file","offset":161792,"path":"DATA/B.BIN","size":2048},{"kind":"file","offset":0,"path":"DATA/EMPTY.BIN","size":0},{"kind":"dir","offset":53248,"path":"DATA/SUB","size":2048},{"kind":"file","offset":163840,"path":"DATA/SUB/C.DAT","size":5000},{"kind":"file","offset":55296,"path":"README.TXT","size":149},{"kind":"file","offset":57344,"path":"SYSTEM.CNF","size":56}],"format":"saturn-dc-raw","source":{"name":"game_2352.bin","sha256":"d35c658b8391300b1a19a4461dbd4dc7405f194cd3abadb3a452c28d8f4530e4","size":169984},"tool_versions":{"7z":"7-Zip 26.02 (x64) 2026-06-25","generator":"make_saturn_dc_raw_fixture v1","pycdlib":"1.16.0"}}
