{"entries":[{"kind":"file","offset":3072,"path":"exefs.bin","size":1452032},{"kind":"file","offset":512,"path":"extendedheader.bin","size":2048},{"kind":"file","offset":2560,"path":"plain.bin","size":512},{"kind":"file","offset":1455104,"path":"romfs.bin","size":84975616}],"format":"3ds-ncch","source":{"name":"partition0.cxi","sha256":"b805cdfdf2965e8a6f90990982bf7386ba755811bea52c5d0902bbb799a6af80","size":86430720},"tool_versions":{"3dstool":"3dstool 1.2.6 by dnasdw","ctrtool":"CTRTool v1.3.0 (C) jakcron","generator":"stage_3ds_ncch_retail_anchor v1"}}
