{"entries":[{"kind":"dir","offset":49152,"path":"BOOT","size":2048},{"kind":"file","offset":59392,"path":"BOOT/APP.ELF","size":100000},{"kind":"dir","offset":51200,"path":"DATA","size":2048},{"kind":"file","offset":159744,"path":"DATA/A.BIN","size":256},{"kind":"file","offset":161792,"path":"DATA/B.BIN","size":2048},{"kind":"file","offset":0,"path":"DATA/EMPTY.BIN","size":0},{"kind":"dir","offset":53248,"path":"DATA/SUB","size":2048},{"kind":"file","offset":163840,"path":"DATA/SUB/C.DAT","size":5000},{"kind":"file","offset":55296,"path":"README.TXT","size":131},{"kind":"file","offset":57344,"path":"SYSTEM.CNF","size":57}],"format":"ciso","source":{"name":"game.ciso","sha256":"c3ac6860ee82a2114acfea97b5ad996b65c2c69df0eb57d4a2a497a72858ed12","size":4699979776},"tool_versions":{"generator":"make_ciso_fixture v1","pycdlib":"1.16.0"}}
