{"entries":[{"kind":"file","offset":8256,"path":"cert.bin","size":128},{"kind":"file","offset":11392,"path":"content.0000.ncch","size":1024},{"kind":"file","offset":12416,"path":"content.0001.ncch","size":512},{"kind":"file","offset":12928,"path":"footer.bin","size":64},{"kind":"file","offset":0,"path":"header.bin","size":8224},{"kind":"file","offset":8384,"path":"ticket.bin","size":64},{"kind":"file","offset":8448,"path":"tmd.bin","size":2916}],"format":"cia","source":{"name":"game.cia","sha256":"5ad8b66db0a32f244a526e6781a8b894002fcea1a930da48109d550ac0daabd1","size":12992},"tool_versions":{"generator":"make_3ds_cia_fixture v1"}}
