{"entries":[{"kind":"file","offset":16384,"path":"partition0.cxi","size":86430720},{"kind":"file","offset":86447104,"path":"partition7.cfa","size":5116416}],"format":"3ds-cci","source":{"name":"Cubic Ninja (Japan).3ds","sha256":"929a675e4dedd315fd6ef5565e6d97b3fd7cd281171c14f2fa0a5163b7096b42","size":134217728},"tool_versions":{"3dstool":"3dstool 1.2.6 by dnasdw","ctrtool":"CTRTool v1.3.0 (C) jakcron","generator":"stage_3ds_cci_retail_anchor v1"}}
