{"entries":[{"kind":"file","offset":58308176,"path":"args.txt","size":24},{"kind":"file","offset":58322944,"path":"art.rcf","size":360728576},{"kind":"file","offset":58308200,"path":"banner.raw","size":6144},{"kind":"file","offset":419051520,"path":"dlg_en.rcf","size":93313024},{"kind":"file","offset":58314344,"path":"icon.raw","size":2048},{"kind":"file","offset":512364544,"path":"misc.rcf","size":10936320},{"kind":"file","offset":523300864,"path":"movies.rcf","size":519413760},{"kind":"file","offset":1042714624,"path":"nis.rcf","size":28702720},{"kind":"file","offset":58316392,"path":"opening.bnr","size":6496},{"kind":"file","offset":58322888,"path":"rcfs.txt","size":56},{"kind":"file","offset":1071417344,"path":"sound.rcf","size":388560896}],"format":"gc-fst","source":{"name":"The Hulk (USA).iso","sha256":"dd1aeb238ca410e02a43ad6ec020fab1c71fdca47db5f42242c1d9f566d6fdcf","size":1459978240},"tool_versions":{"generator":"stage_gc_fst v1","wit":"Wiimms ISO Tool v3.05a r8638 cygwin64 - Dirk Clemens - 2022-08-27"}}
