{"entries":[{"kind":"dir","offset":0,"path":"BOOT","size":0},{"kind":"file","offset":256,"path":"BOOT/APP.BIN","size":10000},{"kind":"dir","offset":0,"path":"DATA","size":0},{"kind":"file","offset":10256,"path":"DATA/A.BIN","size":256},{"kind":"file","offset":10512,"path":"DATA/B.BIN","size":2048},{"kind":"file","offset":12560,"path":"DATA/EMPTY.BIN","size":0},{"kind":"dir","offset":0,"path":"DATA/SUB","size":0},{"kind":"file","offset":12560,"path":"DATA/SUB/C.DAT","size":5000},{"kind":"file","offset":17560,"path":"README.TXT","size":140}],"format":"wii-u8-arc","source":{"name":"archive.arc","sha256":"d25c31478a7cdf8c9d08ce35a76c442d091639a78b190200d9b0db9d306dc1a7","size":17700},"tool_versions":{"generator":"make_wii_u8_arc_fixture v1","self-consistency":"structural-proof"}}
