{"entries":[{"kind":"dir","offset":0,"path":"DATA","size":0},{"kind":"file","offset":4608,"path":"DATA/A.BIN","size":4096},{"kind":"file","offset":8704,"path":"DATA/B.BIN","size":2048},{"kind":"file","offset":10752,"path":"DATA/EMPTY.BIN","size":0},{"kind":"dir","offset":0,"path":"DATA/SUB","size":0},{"kind":"file","offset":10752,"path":"DATA/SUB/C.DAT","size":500},{"kind":"file","offset":4512,"path":"README.TXT","size":89}],"format":"3ds-romfs","source":{"name":"game.romfs","sha256":"66ef6737f27dbff3226346a960413afa082443c376c3d2162a590de47999bfe4","size":20480},"tool_versions":{"differential":"ctrtool v1.3.0","generator":"make_3ds_romfs_fixture v1","self-consistency":"structural-proof"}}
