{"entries":[{"kind":"dir","offset":0,"path":"BOOT","size":0},{"kind":"file","offset":79872,"path":"BOOT/APP.BIN","size":4096},{"kind":"dir","offset":0,"path":"DATA","size":0},{"kind":"file","offset":83968,"path":"DATA/A.BIN","size":256},{"kind":"file","offset":86016,"path":"DATA/B.BIN","size":2048},{"kind":"file","offset":88064,"path":"DATA/EMPTY.BIN","size":0},{"kind":"dir","offset":0,"path":"DATA/SUB","size":0},{"kind":"file","offset":88064,"path":"DATA/SUB/C.DAT","size":2048},{"kind":"file","offset":77824,"path":"README.TXT","size":83}],"format":"xdvdfs","source":{"name":"game.xiso","sha256":"fa85a9abe6b6edab10676fac4b16c19621ca440c36c0dace5a11b9a45a7c6329","size":90113},"tool_versions":{"generator":"make_xdvdfs_fixture v1","self-consistency":"structural-proof"}}
