{"entries":[{"kind":"file","offset":776192,"path":"GR5.DAT","size":778952704},{"kind":"file","offset":634880,"path":"IOPRP214.IMG","size":140945},{"kind":"file","offset":565248,"path":"IOPSYS.IRX","size":69114},{"kind":"file","offset":779728896,"path":"LIBSD.IRX","size":25317},{"kind":"file","offset":779755520,"path":"MCMAN.IRX","size":86341},{"kind":"file","offset":779843584,"path":"MCSERV.IRX","size":6665},{"kind":"file","offset":779851776,"path":"PADMAN.IRX","size":43861},{"kind":"file","offset":779896832,"path":"SIO2MAN.IRX","size":6161},{"kind":"file","offset":779905024,"path":"SLUS_202.55","size":11073038},{"kind":"file","offset":790978560,"path":"SYSTEM.CNF","size":56}],"format":"iso9660","source":{"name":"Gallop Racer 2001 (USA).iso","sha256":"d0b02a886a77491f5636c5bce4f163d6c7922ff23b8ce57e208f6a56a18d2a64","size":790986752},"tool_versions":{"7z":"7-Zip 26.02 (x64) 2026-06-25","generator":"stage_iso9660_retail_anchor v1","pycdlib":"1.16.0"}}
