{"entries":[{"kind":"dir","offset":0,"path":"files","size":0},{"kind":"file","offset":1088,"path":"files/a.bin","size":16},{"kind":"file","offset":1104,"path":"files/b.dat","size":32},{"kind":"dir","offset":0,"path":"files/sub","size":0},{"kind":"file","offset":1136,"path":"files/sub/c.txt","size":8}],"format":"wii-fst","source":{"name":"partition.bin","sha256":"994575f1fb61eafb182a1250d08add2e462bfe65d92e1ff2119ffd9f27e6a566","size":1248},"tool_versions":{"generator":"make_wii_fst_fixture v1"}}
