{"entries":[{"kind":"file","offset":30892032,"path":"BURSTEND.STR","size":19955712},{"kind":"file","offset":11362304,"path":"BURSTOPL.STR","size":19529728},{"kind":"file","offset":272066560,"path":"DMY.BIN","size":49664384},{"kind":"file","offset":659456,"path":"FILE.BIN","size":10702848},{"kind":"file","offset":49152,"path":"SLUS_013.17","size":610304},{"kind":"file","offset":47104,"path":"SYSTEM.CNF","size":68},{"kind":"dir","offset":50847744,"path":"XA","size":2048},{"kind":"file","offset":50849792,"path":"XA/SOTOMAWA.XA","size":110608384},{"kind":"file","offset":161458176,"path":"XA/STAGEBGM.XA","size":110608384}],"format":"ps1-bincue","source":{"name":"BursTrick - Wake Boarding!! (USA).bin","sha256":"293af0bc2523225c31940b6af3b62109c1063213a2fd891b3fd927e2281db7bd","size":322039808},"tool_versions":{"7z":"7-Zip 26.02 (x64) 2026-06-25","chdman":"0.288 (mame0288)","generator":"stage_ps1_form2_retail_anchor v1","pycdlib":"1.16.0"}}
