{"entries":[{"kind":"file","offset":53248,"path":"0.BIN","size":203856},{"kind":"file","offset":258048,"path":"ABS.TXT","size":24},{"kind":"file","offset":260096,"path":"BIB.TXT","size":29},{"kind":"file","offset":262144,"path":"CPY.TXT","size":2},{"kind":"dir","offset":49152,"path":"SATSAVES","size":4096},{"kind":"file","offset":264192,"path":"SATSAVES/BIOUDAT2.BUP","size":608},{"kind":"file","offset":266240,"path":"SATSAVES/BIOUDATA.BUP","size":264},{"kind":"file","offset":268288,"path":"SATSAVES/B_GAREGG.BUP","size":5392},{"kind":"file","offset":274432,"path":"SATSAVES/CREDITS.TXT","size":641},{"kind":"file","offset":276480,"path":"SATSAVES/DAYTONA_.BUP","size":2527},{"kind":"file","offset":280576,"path":"SATSAVES/DRACUL01.BUP","size":4452},{"kind":"file","offset":286720,"path":"SATSAVES/DRACUL02.BUP","size":4452},{"kind":"file","offset":292864,"path":"SATSAVES/DRACULAX.BUP","size":4452},{"kind":"file","offset":299008,"path":"SATSAVES/DR_FORCE.BUP","size":18208},{"kind":"file","offset":317440,"path":"SATSAVES/FALC2COM.BUP","size":100},{"kind":"file","offset":319488,"path":"SATSAVES/FALC2Y20.BUP","size":260},{"kind":"file","offset":321536,"path":"SATSAVES/FALC2Y21.BUP","size":260},{"kind":"file","offset":323584,"path":"SATSAVES/FALC2Y22.BUP","size":260},{"kind":"file","offset":325632,"path":"SATSAVES/FANTASYZ.BUP","size":208},{"kind":"file","offset":327680,"path":"SATSAVES/FIGHTERS.BUP","size":1460},{"kind":"file","offset":329728,"path":"SATSAVES/GOIKE001.BUP","size":3120},{"kind":"file","offset":333824,"path":"SATSAVES/GOIKEDAT.BUP","size":776},{"kind":"file","offset":335872,"path":"SATSAVES/GUARDIAN.BUP","size":1224},{"kind":"file","offset":337920,"path":"SATSAVES/HARRIE01.BUP","size":740},{"kind":"file","offset":339968,"path":"SATSAVES/HOUSEOFD.BUP","size":1232},{"kind":"file","offset":342016,"path":"SATSAVES/KEIO2___.BUP","size":96},{"kind":"file","offset":344064,"path":"SATSAVES/LANGRIS5.BUP","size":13616},{"kind":"file","offset":358400,"path":"SATSAVES/NIGHTS02.BUP","size":12608},{"kind":"file","offset":372736,"path":"SATSAVES/OUTRUN01.BUP","size":1184},{"kind":"file","offset":374784,"path":"SATSAVES/POCKET_F.BUP","size":384},{"kind":"file","offset":376832,"path":"SATSAVES/PZL_F_TU.BUP","size":544},{"kind":"file","offset":378880,"path":"SATSAVES/QUTENKAI.BUP","size":548},{"kind":"file","offset":380928,"path":"SATSAVES/RADIANT_.BUP","size":1932},{"kind":"file","offset":382976,"path":"SATSAVES/SALAMAND.BUP","size":562},{"kind":"file","offset":385024,"path":"SATSAVES/SBOMBERM.BUP","size":302},{"kind":"file","offset":387072,"path":"SATSAVES/SEGARALL.BUP","size":62528},{"kind":"file","offset":450560,"path":"SATSAVES/SENGOKU_.BUP","size":536},{"kind":"file","offset":452608,"path":"SATSAVES/SFORCE31.BUP","size":12968},{"kind":"file","offset":466944,"path":"SATSAVES/SFZER001.BUP","size":5376},{"kind":"file","offset":473088,"path":"SATSAVES/SFZER002.BUP","size":5376},{"kind":"file","offset":479232,"path":"SATSAVES/SF_ALPH1.BUP","size":2068},{"kind":"file","offset":483328,"path":"SATSAVES/SF_ALPHA.BUP","size":544},{"kind":"file","offset":485376,"path":"SATSAVES/SF_COL02.BUP","size":344},{"kind":"file","offset":487424,"path":"SATSAVES/SF_COL03.BUP","size":544},{"kind":"file","offset":489472,"path":"SATSAVES/SONICR__.BUP","size":400},{"kind":"file","offset":491520,"path":"SATSAVES/SOQGUREN.BUP","size":1642},{"kind":"file","offset":493568,"path":"SATSAVES/TAMAGOTC.BUP","size":34052},{"kind":"file","offset":528384,"path":"SATSAVES/TENCHIRE.BUP","size":160},{"kind":"file","offset":530432,"path":"SATSAVES/ZENNIC01.BUP","size":208},{"kind":"file","offset":532480,"path":"SATSAVES/ZENNIC02.BUP","size":2464}],"format":"saturn-dc-raw","source":{"name":"game_2352.bin","sha256":"e1832e07d4e8273f0db45bcd61fbacffac21468554f87c328619a66a5f4871a8","size":843776},"tool_versions":{"7z":"7-Zip 26.02 (x64) 2026-06-25","ecm":"ECM/UNECM v1.3.0 (v1.3.1 release asset)","generator":"stage_saturn_homebrew_anchor v1","pycdlib":"1.16.0"}}
