{"entries":[{"kind":"file","offset":260046848,"path":"partition-data.bin","size":4424728576},{"kind":"file","offset":327680,"path":"partition-update.bin","size":187334656}],"format":"wii-disc","source":{"name":"The Munchables (USA).iso","sha256":"64c012f35d0c8b97e34c13e47060550b36d89fc36bed2691661cfdf108671cbb","size":4699979776},"tool_versions":{"generator":"stage_wii_disc_retail_anchor v1","wit":"Wiimms ISO Tool v3.05a r8638 cygwin64 - Dirk Clemens - 2022-08-27"}}
